,responses,similarities,probs
84,"Many teachers encourage silent reading in class for several reasons. First, silent reading helps students develop their reading skills and comprehension. When students are encouraged to read silently, they are forced to focus their attention solely on the text and not on their classmates or teacher. This helps them better understand the material and engage with the",0.903567910194397,-0.6154397436012333
85,"Richard Chamberlain gained television stardom playing the role of the character ""Jeanie Caldwell"" in the television series ""The Big Valley,"" which aired on NBC from 1965 to 1969. In the show, he starred as a handsome young man trying to come",0.703079104423523,-0.8395662370528466
86,"The Inspection Generale des Finances (IGF) in France is an autonomous administrative body responsible for supervising the French financial sector. The number of members of the IGF is not specified, as the organization operates with a rotating board of inspectors. However, the board consists of five members who",0.7603038549423218,-0.7584378940558769
87,"Christa McAuliffe was born on September 24, 1949. She died on January 28, 1986, at the age of 37.

(Sources: Biography.com. (2022, May 17). Robert F",0.8537392616271973,-0.5369569471273857
88,"The Nakh language group, alsoʊkalled NaxLanguage group, consists of eight languages:

1. Akhutsidis Aini:
This is the only remaining speaker of this language, which was previously spoken by approximately 400 people.

1. Akha:
The",0.896424412727356,-1.5767892264925698
89,"The Ox-Bow Incident is a lynching of five men in the western United States. The number of men lynched is five. However, I cannot provide any specific names as no records exist regarding this event. This question is intended to serve as a general reference. 
Please refer to your",0.9013639688491821,-1.2281779292783517
90,"According to the United States Census Bureau, the population of Poweshiek County, Iowa, as of the 2020 census, is approximately 17,919. This represents a decline of 0.29.296 from the 2010 census when the county had",0.934670627117157,-0.7524140015303142
91,"Anvar Chingizoglu is from Uzbekistan. Uzbekistan is a country in Central Asia, and it is known for its rich cultural history, stunning architecture, and diverse cuisine. Uzbekistan gained independence from the Soviet Union in 1991 and is home to a",0.7522679567337036,-0.47298970061607853
92,"According to data from the Austria Statistical Office, as of 2021, the population of Auer, South Tyrol is approximately 5,868 people. This number includes both residents and non-residents. Please note that this data may not be entirely accurate as it may not reflect",0.9152490496635437,-0.7016299506326013
93,"Linton is located in Indiana, United States. It is a town situated in Johnson County, in the eastern part of the state. According to the United States Census Bureau, the town's population as of the 2020 census was 317, with an area of 2.05",0.8346595764160156,-0.6845224627097216
94,"Bowfin are fish species that are known for their long lifespans. They have a natural lifespan in the wild ranging from 8 to 22 years or even longer, depending on various factors such as habitat quality and predation pressure. Bowfin can live in various aquatic environments, including freshwater",0.8934256434440613,-0.8654371105717041
95,"Jerome Cooper died on July 4, 1972. He was 62 years old. Cooper was an American film and television actor who had a distinguished career in the entertainment industry. He appeared in numerous films and television shows during the 1960s and 1970s",0.8675849437713623,-0.5793605976641013
96,"Alex Rodriguez hit 694 home runs in his Major League Baseball (MLB) career. This record is one of the most notable in the history of the sport, as home runs are typically only hit with a swing of the bat.

Alex Rodriguez's career began with the",0.8651400208473206,-0.7380951861025515
97,"Carlo Fonseka strongly supported Marxism. He was a prominent political figure in Sri Lanka, known for his radical political views and support for revolutionary groups, including the Tamil Tigers. He believed in using political violence as a means to achieve political change, and his political philosophy heavily influenced many radical political movements",0.738132119178772,-0.8722990614226591
98,"Belinda is a novel written by Margaret Dunlap. Margaret Dunlap is a well-known author and screenwriter. Her other notable works include the novels ""Charlotte"" and ""Nina"" as well as the screenplay for the film ""Heidi"".
Dunlap has a Master's degree",0.825059175491333,-0.9053804661782074
99,"Calling Time is a album released in 2007 by a music group called Moldove. The album explores various themes such as introspection, social criticism, and politics. Many of the songs on the album have uplifting and empowering lyrics, encouraging listeners to take action and make a",0.8392941951751709,-1.0171202562528079
